{
 "formatVersion": 1,
 "collectedAt": "2026-09-20T19:11:25+09:00",
 "collector": {
  "name": "catalog_snapshot.py",
  "version": "1"
 },
 "database": {
  "name": "FREE",
  "version": "23.26.3.0.0"
 },
 "schema": "EXPLORER",
 "containsDataValues": false,
 "skipped": [],
 "tables": [
  {
   "name": "AUDIT_LOG",
   "temporary": false,
   "partitioned": false,
   "comment": null
  },
  {
   "name": "CUSTOMERS",
   "temporary": false,
   "partitioned": false,
   "comment": null
  },
  {
   "name": "ORDERS",
   "temporary": false,
   "partitioned": false,
   "comment": null
  },
  {
   "name": "ORDER_ITEMS",
   "temporary": false,
   "partitioned": false,
   "comment": null
  },
  {
   "name": "PRODUCTS",
   "temporary": false,
   "partitioned": false,
   "comment": null
  },
  {
   "name": "SHIPMENTS",
   "temporary": false,
   "partitioned": false,
   "comment": null
  }
 ],
 "columns": [
  {
   "table": "AUDIT_LOG",
   "name": "LOG_ID",
   "position": 1,
   "dataType": "NUMBER",
   "length": 22,
   "precision": 12,
   "scale": 0,
   "nullable": false
  },
  {
   "table": "AUDIT_LOG",
   "name": "TABLE_NAME",
   "position": 2,
   "dataType": "VARCHAR2",
   "length": 30,
   "precision": null,
   "scale": null,
   "nullable": false
  },
  {
   "table": "AUDIT_LOG",
   "name": "DETAIL",
   "position": 3,
   "dataType": "VARCHAR2",
   "length": 400,
   "precision": null,
   "scale": null,
   "nullable": true
  },
  {
   "table": "AUDIT_LOG",
   "name": "LOGGED_AT",
   "position": 4,
   "dataType": "DATE",
   "length": 7,
   "precision": null,
   "scale": null,
   "nullable": false
  },
  {
   "table": "CUSTOMERS",
   "name": "CUSTOMER_ID",
   "position": 1,
   "dataType": "NUMBER",
   "length": 22,
   "precision": 10,
   "scale": 0,
   "nullable": false
  },
  {
   "table": "CUSTOMERS",
   "name": "NAME",
   "position": 2,
   "dataType": "VARCHAR2",
   "length": 100,
   "precision": null,
   "scale": null,
   "nullable": false
  },
  {
   "table": "CUSTOMERS",
   "name": "EMAIL",
   "position": 3,
   "dataType": "VARCHAR2",
   "length": 200,
   "precision": null,
   "scale": null,
   "nullable": true
  },
  {
   "table": "ORDERS",
   "name": "ORDER_ID",
   "position": 1,
   "dataType": "NUMBER",
   "length": 22,
   "precision": 12,
   "scale": 0,
   "nullable": false
  },
  {
   "table": "ORDERS",
   "name": "CUSTOMER_ID",
   "position": 2,
   "dataType": "NUMBER",
   "length": 22,
   "precision": 10,
   "scale": 0,
   "nullable": false
  },
  {
   "table": "ORDERS",
   "name": "ORDER_DATE",
   "position": 3,
   "dataType": "DATE",
   "length": 7,
   "precision": null,
   "scale": null,
   "nullable": false
  },
  {
   "table": "ORDERS",
   "name": "STATUS",
   "position": 4,
   "dataType": "VARCHAR2",
   "length": 20,
   "precision": null,
   "scale": null,
   "nullable": false
  },
  {
   "table": "ORDERS",
   "name": "TOTAL_AMOUNT",
   "position": 5,
   "dataType": "NUMBER",
   "length": 22,
   "precision": 18,
   "scale": 2,
   "nullable": true
  },
  {
   "table": "ORDER_ITEMS",
   "name": "ORDER_ID",
   "position": 1,
   "dataType": "NUMBER",
   "length": 22,
   "precision": 12,
   "scale": 0,
   "nullable": false
  },
  {
   "table": "ORDER_ITEMS",
   "name": "LINE_NO",
   "position": 2,
   "dataType": "NUMBER",
   "length": 22,
   "precision": 4,
   "scale": 0,
   "nullable": false
  },
  {
   "table": "ORDER_ITEMS",
   "name": "PRODUCT_ID",
   "position": 3,
   "dataType": "NUMBER",
   "length": 22,
   "precision": 10,
   "scale": 0,
   "nullable": false
  },
  {
   "table": "ORDER_ITEMS",
   "name": "QUANTITY",
   "position": 4,
   "dataType": "NUMBER",
   "length": 22,
   "precision": 10,
   "scale": 0,
   "nullable": false
  },
  {
   "table": "ORDER_ITEMS",
   "name": "UNIT_PRICE",
   "position": 5,
   "dataType": "NUMBER",
   "length": 22,
   "precision": 12,
   "scale": 2,
   "nullable": false
  },
  {
   "table": "PRODUCTS",
   "name": "PRODUCT_ID",
   "position": 1,
   "dataType": "NUMBER",
   "length": 22,
   "precision": 10,
   "scale": 0,
   "nullable": false
  },
  {
   "table": "PRODUCTS",
   "name": "STOCK_QUANTITY",
   "position": 2,
   "dataType": "NUMBER",
   "length": 22,
   "precision": 10,
   "scale": 0,
   "nullable": false
  },
  {
   "table": "PRODUCTS",
   "name": "UNIT_PRICE",
   "position": 3,
   "dataType": "NUMBER",
   "length": 22,
   "precision": 12,
   "scale": 2,
   "nullable": false
  },
  {
   "table": "PRODUCTS",
   "name": "UPDATED_AT",
   "position": 4,
   "dataType": "TIMESTAMP(6)",
   "length": 11,
   "precision": null,
   "scale": 6,
   "nullable": true
  },
  {
   "table": "SHIPMENTS",
   "name": "SHIPMENT_ID",
   "position": 1,
   "dataType": "NUMBER",
   "length": 22,
   "precision": 12,
   "scale": 0,
   "nullable": false
  },
  {
   "table": "SHIPMENTS",
   "name": "ORDER_ID",
   "position": 2,
   "dataType": "NUMBER",
   "length": 22,
   "precision": 12,
   "scale": 0,
   "nullable": false
  },
  {
   "table": "SHIPMENTS",
   "name": "SHIPPED_AT",
   "position": 3,
   "dataType": "DATE",
   "length": 7,
   "precision": null,
   "scale": null,
   "nullable": true
  },
  {
   "table": "SHIPMENTS",
   "name": "CARRIER",
   "position": 4,
   "dataType": "VARCHAR2",
   "length": 40,
   "precision": null,
   "scale": null,
   "nullable": true
  }
 ],
 "constraints": [
  {
   "name": "PK_E_AUDIT_LOG",
   "table": "AUDIT_LOG",
   "type": "PRIMARY KEY",
   "columns": [
    "LOG_ID"
   ],
   "enabled": true,
   "generated": false
  },
  {
   "name": "SYS_C009341",
   "table": "AUDIT_LOG",
   "type": "CHECK",
   "columns": [
    "LOG_ID"
   ],
   "enabled": true,
   "generated": true,
   "condition": "\"LOG_ID\" IS NOT NULL"
  },
  {
   "name": "SYS_C009342",
   "table": "AUDIT_LOG",
   "type": "CHECK",
   "columns": [
    "TABLE_NAME"
   ],
   "enabled": true,
   "generated": true,
   "condition": "\"TABLE_NAME\" IS NOT NULL"
  },
  {
   "name": "SYS_C009343",
   "table": "AUDIT_LOG",
   "type": "CHECK",
   "columns": [
    "LOGGED_AT"
   ],
   "enabled": true,
   "generated": true,
   "condition": "\"LOGGED_AT\" IS NOT NULL"
  },
  {
   "name": "PK_E_CUSTOMERS",
   "table": "CUSTOMERS",
   "type": "PRIMARY KEY",
   "columns": [
    "CUSTOMER_ID"
   ],
   "enabled": true,
   "generated": false
  },
  {
   "name": "SYS_C009313",
   "table": "CUSTOMERS",
   "type": "CHECK",
   "columns": [
    "CUSTOMER_ID"
   ],
   "enabled": true,
   "generated": true,
   "condition": "\"CUSTOMER_ID\" IS NOT NULL"
  },
  {
   "name": "SYS_C009314",
   "table": "CUSTOMERS",
   "type": "CHECK",
   "columns": [
    "NAME"
   ],
   "enabled": true,
   "generated": true,
   "condition": "\"NAME\" IS NOT NULL"
  },
  {
   "name": "UQ_E_CUSTOMERS_EMAIL",
   "table": "CUSTOMERS",
   "type": "UNIQUE",
   "columns": [
    "EMAIL"
   ],
   "enabled": true,
   "generated": false
  },
  {
   "name": "FK_E_ORDERS_CUSTOMER",
   "table": "ORDERS",
   "type": "FOREIGN KEY",
   "columns": [
    "CUSTOMER_ID"
   ],
   "enabled": true,
   "generated": false,
   "refOwner": "EXPLORER",
   "refConstraint": "PK_E_CUSTOMERS",
   "refTable": "CUSTOMERS",
   "refColumns": [
    "CUSTOMER_ID"
   ],
   "deleteRule": "NO ACTION"
  },
  {
   "name": "PK_E_ORDERS",
   "table": "ORDERS",
   "type": "PRIMARY KEY",
   "columns": [
    "ORDER_ID"
   ],
   "enabled": true,
   "generated": false
  },
  {
   "name": "SYS_C009322",
   "table": "ORDERS",
   "type": "CHECK",
   "columns": [
    "ORDER_ID"
   ],
   "enabled": true,
   "generated": true,
   "condition": "\"ORDER_ID\" IS NOT NULL"
  },
  {
   "name": "SYS_C009323",
   "table": "ORDERS",
   "type": "CHECK",
   "columns": [
    "CUSTOMER_ID"
   ],
   "enabled": true,
   "generated": true,
   "condition": "\"CUSTOMER_ID\" IS NOT NULL"
  },
  {
   "name": "SYS_C009324",
   "table": "ORDERS",
   "type": "CHECK",
   "columns": [
    "ORDER_DATE"
   ],
   "enabled": true,
   "generated": true,
   "condition": "\"ORDER_DATE\" IS NOT NULL"
  },
  {
   "name": "SYS_C009325",
   "table": "ORDERS",
   "type": "CHECK",
   "columns": [
    "STATUS"
   ],
   "enabled": true,
   "generated": true,
   "condition": "\"STATUS\" IS NOT NULL"
  },
  {
   "name": "CK_E_ITEMS_QUANTITY",
   "table": "ORDER_ITEMS",
   "type": "CHECK",
   "columns": [
    "QUANTITY"
   ],
   "enabled": true,
   "generated": false,
   "condition": "quantity > 0"
  },
  {
   "name": "FK_E_ITEMS_ORDER",
   "table": "ORDER_ITEMS",
   "type": "FOREIGN KEY",
   "columns": [
    "ORDER_ID"
   ],
   "enabled": true,
   "generated": false,
   "refOwner": "EXPLORER",
   "refConstraint": "PK_E_ORDERS",
   "refTable": "ORDERS",
   "refColumns": [
    "ORDER_ID"
   ],
   "deleteRule": "CASCADE"
  },
  {
   "name": "FK_E_ITEMS_PRODUCT",
   "table": "ORDER_ITEMS",
   "type": "FOREIGN KEY",
   "columns": [
    "PRODUCT_ID"
   ],
   "enabled": true,
   "generated": false,
   "refOwner": "EXPLORER",
   "refConstraint": "PK_E_PRODUCTS",
   "refTable": "PRODUCTS",
   "refColumns": [
    "PRODUCT_ID"
   ],
   "deleteRule": "NO ACTION"
  },
  {
   "name": "PK_E_ORDER_ITEMS",
   "table": "ORDER_ITEMS",
   "type": "PRIMARY KEY",
   "columns": [
    "ORDER_ID",
    "LINE_NO"
   ],
   "enabled": true,
   "generated": false
  },
  {
   "name": "SYS_C009328",
   "table": "ORDER_ITEMS",
   "type": "CHECK",
   "columns": [
    "ORDER_ID"
   ],
   "enabled": true,
   "generated": true,
   "condition": "\"ORDER_ID\" IS NOT NULL"
  },
  {
   "name": "SYS_C009329",
   "table": "ORDER_ITEMS",
   "type": "CHECK",
   "columns": [
    "LINE_NO"
   ],
   "enabled": true,
   "generated": true,
   "condition": "\"LINE_NO\" IS NOT NULL"
  },
  {
   "name": "SYS_C009330",
   "table": "ORDER_ITEMS",
   "type": "CHECK",
   "columns": [
    "PRODUCT_ID"
   ],
   "enabled": true,
   "generated": true,
   "condition": "\"PRODUCT_ID\" IS NOT NULL"
  },
  {
   "name": "SYS_C009331",
   "table": "ORDER_ITEMS",
   "type": "CHECK",
   "columns": [
    "QUANTITY"
   ],
   "enabled": true,
   "generated": true,
   "condition": "\"QUANTITY\" IS NOT NULL"
  },